{
  "connector_instance_id": "11111111-1111-4111-8111-111111111111",
  "connector_version": "1.0.0",
  "runtime_generation": "runtime-20260730-01",
  "required_capabilities": [
    "session.observe"
  ],
  "optional_capabilities": [
    "session.observe.output-parity.v1",
    "session.control",
    "view.card"
  ],
  "resume": {
    "mode": "fresh",
    "next_outbound_sequence": 0,
    "next_inbound_sequence": 0
  }
}
